{
  "schema": "d1_knowledge_record/v1",
  "record_id": "d1_ps4_executable_build_anchors_2026_09_26",
  "title": "Destiny 1 PS4 executable build identity and code-side RE frontier",
  "updated_utc": "2026-09-26T12:00:00Z",
  "scope": {
    "game": "Destiny 1",
    "platform": "PS4",
    "title_id": "CUSA00219",
    "canonical_target_version": "01.33"
  },
  "nodes": [
    {
      "id": "title:CUSA00219",
      "kind": "ps4_title",
      "status": "PROVEN",
      "label": "Destiny 1 US PS4",
      "attrs": {
        "content_id": "UP0002-CUSA00219_00-DESTINYTHEGAME01"
      }
    },
    {
      "id": "executable:CUSA00219:01.29:eboot",
      "kind": "executable_build",
      "status": "STRONGLY_SUPPORTED",
      "label": "CUSA00219 01.29 decrypted eboot.bin",
      "attrs": {
        "sha256": "7271fcb926401df8defb126cb8eb2b247134138b81e401bbacb2ab60791b795",
        "binary_present_in_repo": false
      }
    },
    {
      "id": "executable:CUSA00219:01.33:eboot",
      "kind": "executable_build",
      "status": "TARGET",
      "label": "CUSA00219 01.33 final PS4 eboot.bin",
      "attrs": {
        "sha256": null,
        "binary_present_in_repo": false,
        "canonical_final_target": true
      }
    },
    {
      "id": "code_anchor:CUSA00219:graphics_heartbeat:FAAF4",
      "kind": "runtime_code_anchor",
      "status": "STRONGLY_SUPPORTED",
      "label": "Graphics Heartbeat code-offset neighborhood 0xFAAF4",
      "attrs": {
        "offset": "0xFAAF4",
        "function_name_proven": false
      }
    },
    {
      "id": "tool:d1_executable_probe",
      "kind": "re_tool",
      "status": "PROVEN",
      "label": "tools/d1_executable_probe.py"
    }
  ],
  "edges": [
    {
      "id": "edge:title_0129",
      "subject": "title:CUSA00219",
      "predicate": "HAS_EXECUTABLE_BUILD",
      "object": "executable:CUSA00219:01.29:eboot",
      "status": "STRONGLY_SUPPORTED",
      "assertion_ids": ["assert_0129_fingerprint"]
    },
    {
      "id": "edge:title_0133",
      "subject": "title:CUSA00219",
      "predicate": "HAS_TARGET_EXECUTABLE_BUILD",
      "object": "executable:CUSA00219:01.33:eboot",
      "status": "TARGET",
      "assertion_ids": ["assert_0133_target"]
    },
    {
      "id": "edge:anchor_0129",
      "subject": "executable:CUSA00219:01.29:eboot",
      "predicate": "HAS_RUNTIME_CODE_ANCHOR",
      "object": "code_anchor:CUSA00219:graphics_heartbeat:FAAF4",
      "status": "STRONGLY_SUPPORTED",
      "assertion_ids": ["assert_graphics_anchor"]
    },
    {
      "id": "edge:probe_target",
      "subject": "tool:d1_executable_probe",
      "predicate": "FINGERPRINTS",
      "object": "executable:CUSA00219:01.33:eboot",
      "status": "TARGET",
      "assertion_ids": ["assert_probe_role"]
    }
  ],
  "assertions": [
    {
      "id": "assert_0129_fingerprint",
      "status": "STRONGLY_SUPPORTED",
      "claim": "A public Destiny 1 CUSA00219 01.29 preservation/emulation report identifies a decrypted eboot.bin with SHA-256 7271fcb926401df8defb126cb8eb2b247134138b81e401bbacb2ab60791b795.",
      "source_ids": ["src_gbatemp_0129"],
      "details": {
        "verification_limit": "The binary itself is not stored in this repository and the hash has not yet been independently recomputed here."
      }
    },
    {
      "id": "assert_0133_target",
      "status": "STRONGLY_SUPPORTED",
      "claim": "CUSA00219 application version 01.33 is publicly represented by an owner-dumped unmodified build in the shadPS4 compatibility record and is the code-side canonical final-build target for this repository.",
      "source_ids": ["src_shadps4_issue_994", "src_local_executable_evidence"]
    },
    {
      "id": "assert_graphics_anchor",
      "status": "STRONGLY_SUPPORTED",
      "claim": "Public CUSA00219 runtime reports associate code offset 0xFAAF4 with the Graphics Heartbeat failure path; the offset is retained only as a code-side anchor and not as a proven function identity.",
      "source_ids": ["src_shadps4_issue_994"]
    },
    {
      "id": "assert_probe_role",
      "status": "PROVEN",
      "claim": "tools/d1_executable_probe.py computes SHA-256 and classifies an already-available executable as PS4 SELF, ELF, or unknown before build-specific RE evidence is attached.",
      "source_ids": ["src_probe_tool"]
    }
  ],
  "sources": [
    {
      "id": "src_gbatemp_0129",
      "kind": "public_forum_report",
      "locator": "https://gbatemp.net/threads/looking-for-destiny-1-usa-cusa00219-specific-patch-version-up-to-v1-29.683928/",
      "sha256": null,
      "details": {
        "role": "reported decrypted 01.29 eboot fingerprint"
      }
    },
    {
      "id": "src_shadps4_issue_994",
      "kind": "public_compatibility_report",
      "locator": "https://github.com/shadps4-compatibility/shadps4-game-compatibility/issues/994",
      "sha256": null,
      "details": {
        "role": "CUSA00219 01.33 owner-dump runtime report and Graphics Heartbeat observations"
      }
    },
    {
      "id": "src_local_executable_evidence",
      "kind": "repository_evidence",
      "locator": "evidence/d1_ps4_executable_build_anchors_2026-09-26.json",
      "sha256": null
    },
    {
      "id": "src_probe_tool",
      "kind": "repository_tool",
      "locator": "tools/d1_executable_probe.py",
      "sha256": null
    }
  ],
  "rejections": [],
  "frontiers": [
    {
      "id": "frontier_obtain_any_ps4_eboot",
      "question": "Can an already-decrypted Destiny 1 PS4 executable from any known build be obtained for code-side analysis?",
      "next_proof": "Acquire a lawfully available candidate executable, run tools/d1_executable_probe.py, record its exact SHA-256/build identity, then begin strings/imports/function-boundary analysis without committing retail bytes.",
      "related_nodes": [
        "executable:CUSA00219:01.29:eboot",
        "executable:CUSA00219:01.33:eboot",
        "tool:d1_executable_probe"
      ]
    },
    {
      "id": "frontier_0133_fingerprint",
      "question": "What is the independently verified SHA-256 of the decrypted CUSA00219 01.33 eboot.bin?",
      "next_proof": "Fingerprint a verified 01.33 owner dump and promote the executable node from TARGET once exact identity evidence is retained.",
      "related_nodes": ["executable:CUSA00219:01.33:eboot"]
    },
    {
      "id": "frontier_cross_version_anchor",
      "question": "Does the Graphics Heartbeat 0xFAAF4 neighborhood correspond to the same function/content across 01.29 and 01.33?",
      "next_proof": "Compare bytes, CFG, imports/xrefs, or stable signatures in both exact builds; do not infer equality from matching runtime offsets alone.",
      "related_nodes": [
        "code_anchor:CUSA00219:graphics_heartbeat:FAAF4",
        "executable:CUSA00219:01.29:eboot",
        "executable:CUSA00219:01.33:eboot"
      ]
    }
  ]
}
